{"benchmark": {"acceptance_budget_status": "baseline_only_p7_budget_deferred_to_p8", "benchmark_schema_version": "1.0.0", "edge_count_reported": 50000, "edges": 50000, "edges_per_target": 5, "environment": {"max_rss_kib": 41608, "platform": "Linux-6.18.44-x86_64-with-glibc2.39", "python": "3.12.14"}, "operations": {"changed_diffs": 100, "markdown_renders": 10000, "rendered_bytes": 507780, "structured_diffs": 10000}, "query_hits": 500, "seconds": {"fixture": 0.0766113290001158, "graph_build": 0.02249803599988809, "graph_serialize": 0.004079727999851457, "markdown_render": 0.06699086900061957, "reverse_queries": 0.0007639510004082695, "structured_diff": 0.03659799600063707, "total": 0.20761453900013294}, "targets": 10000}, "benchmark_schema_version": "2.0.0", "budget": {"benchmark_schema_version": "2.0.0", "budget_schema_version": "1.0.0", "fixture": {"edges": 50000, "markdown_renders": 10000, "structured_diffs": 10000, "targets": 10000}, "limits": {"changed_diffs_must_equal": 100, "edge_count_must_equal": 50000, "markdown_renders_must_equal": 10000, "max_rss_kib": 262144, "normalized_total_ratio_max": 4.0, "query_hits_must_equal": 500, "structured_diffs_must_equal": 10000, "targets_must_equal": 10000}, "normalization": {"description": "Benchmark total wall time divided by median wall time of a deterministic 3,000,000-iteration Python integer-mix calibration on the same interpreter/environment.", "iterations": 3000000, "kind": "pure_python_integer_mix_v1", "samples": 5, "statistic": "median"}, "policy": {"blocking": true, "established_before_release_rerun": true, "p7_reference": "plan/evidence/P7/benchmark_10k_50k.json", "rationale": "The normalized ratio limits CPU-relative runtime without binding release acceptance to one host's clock speed. The 256 MiB RSS ceiling provides >2x headroom over the P7 10k/50k baseline while still catching gross scalability regressions. Exact workload/correctness counts prevent a faster run from passing by doing less work."}}, "budget_sha256": "aaf4bc233c4f9d8b9c113cc9aafc9c90559306b61be91afeabe0d923e7eb7fda", "calibration": {"median_seconds": 0.7931987079991814, "samples_seconds": [0.7294235809995371, 0.7943805579998298, 0.7971203639999658, 0.7931987079991814, 0.7154282720002811]}, "checks": {"changed_diffs": {"actual": 100, "limit": 100, "ok": true}, "edge_count": {"actual": 50000, "limit": 50000, "ok": true}, "markdown_renders": {"actual": 10000, "limit": 10000, "ok": true}, "max_rss_kib": {"actual": 41608, "limit": 262144, "ok": true}, "normalized_total_ratio": {"actual": 0.2617434154977812, "limit": 4.0, "ok": true}, "query_hits": {"actual": 500, "limit": 500, "ok": true}, "structured_diffs": {"actual": 10000, "limit": 10000, "ok": true}, "targets": {"actual": 10000, "limit": 10000, "ok": true}}, "ok": true}
